{
  "$schema": "../../schema/product.json",
  "title": ["Pont Neuf", "Diario de Laboratorio I"],
  "author": "Sofia Milena",
  "authorId": "sofia-milena",
  "price": 12.0,
  "weight": 130,
  "soldOut": true,
  "details": {
    "publisher": "quien no corre, vuela",
    "binding": {"es": "cosido", "ca": "cosit", "en": "sewn-bound"},
    "pages": null,
    "size": "148 × 210 mm",
    "year": {"es": "febrero 2025", "ca": "febrer 2025", "en": "February 2025"},
    "edition": {
      "es": "2ª edición · 20 copias",
      "ca": "2a edició · 20 còpies",
      "en": "2nd edition · 20 copies"
    }
  },
  "text": {
    "es": [
      "El fanzine “Pont Neuf” gira en torno a la idea de proceso. Por un lado, el proceso técnico que tiene lugar en el laboratorio analógico (aprender una nueva técnica —en este caso, el positivado Lith—) con todo lo que conlleva la propia naturaleza de aprender: errores, apuntes y diferentes versiones de una misma imagen, y que el propio tiempo va dejando huella de una evolución y una mejora, a veces sutil, otras más evidente.",
      "De forma simultánea, se presenta un recorrido por diferentes ciudades y los retratos de una misma persona en diferentes momentos a lo largo de un año, como testigos de un vínculo. Las imágenes se mezclan entre escritos y pruebas. Al fin y al cabo, ¿no es un vínculo algo que se construye con el tiempo, con aciertos y errores, con cambios y aprendizajes?"
    ],
    "ca": [
      "El fanzine “Pont Neuf” gira al voltant de la idea de procés. D’una banda, procés tècnic que té lloc al laboratori analògic (aprendre una nova tècnica —en aquest cas, el positivat Lith—) amb tot allò que comporta la pròpia naturalesa d’aprendre: errors, apunts i diferents versions d’una mateixa imatge i que el propi temps va deixant empremta d’una evolució i una millora, de vegades subtil, d’altres més evident.",
      "De forma simultànea, es presenta un recorregut per diferents ciutats i els retrats d’una mateixa persona en diferents moments al llarg d’un any, com a testimonis d’un vincle; les imatges es barregen entre escrits i proves. Al cap i a la fi, ¿no és un vincle quelcom que es construeix amb el temps, amb encerts i errors, amb canvis i aprenentatges?"
    ],
    "en": [
      "The fanzine “Pont Neuf” revolves around the idea of process which, on the one hand, reveals the technical process that takes place in the analog darkroom (learning a new technique —in this case, Lith printing—) along with everything inherent to the act of learning itself: mistakes, notes, and different versions of the same image, where time itself leaves traces of evolution and improvement, sometimes subtle, other times more evident.",
      "At the same time, it presents a journey through different cities and portraits of the same person at different moments over the course of a year, as witnesses to a bond. The images intertwine with writings and test prints. After all, isn’t a bond something that is built over time, through successes and mistakes, changes and learning?"
    ]
  },
  "photos": ["1", "2", "3", "4", "5", "6"]
}
